{
  "$schema": "https://json-schema.org/draft/2020-12/schema",
  "$id": "https://signbridge.example/schemas/translated-sign-utterance-v1.json",
  "title": "TranslatedSignUtteranceV1",
  "type": "object",
  "additionalProperties": false,
  "required": [
    "type",
    "schema_version",
    "message_id",
    "client_sequence",
    "source_language",
    "target_language",
    "is_final",
    "completion_reason",
    "producer",
    "words"
  ],
  "properties": {
    "type": {
      "const": "translated_sign_utterance"
    },
    "schema_version": {
      "const": "1.0"
    },
    "message_id": {
      "type": "string",
      "format": "uuid"
    },
    "client_sequence": {
      "type": "integer",
      "minimum": 0,
      "maximum": 9007199254740991
    },
    "source_language": {
      "const": "asl"
    },
    "target_language": {
      "const": "en"
    },
    "is_final": {
      "const": true
    },
    "completion_reason": {
      "const": "user_commit"
    },
    "producer": {
      "$ref": "#/$defs/producer"
    },
    "words": {
      "type": "array",
      "minItems": 1,
      "maxItems": 64,
      "items": {
        "$ref": "#/$defs/wordToken"
      }
    }
  },
  "$defs": {
    "identifier": {
      "type": "string",
      "minLength": 1,
      "maxLength": 80,
      "pattern": "^[A-Za-z0-9][A-Za-z0-9._:-]{0,79}$"
    },
    "englishWord": {
      "type": "string",
      "minLength": 1,
      "maxLength": 80,
      "pattern": "^[A-Z0-9]+(?:['-][A-Z0-9]+)*$"
    },
    "score": {
      "type": "number",
      "minimum": 0,
      "maximum": 1
    },
    "producer": {
      "type": "object",
      "additionalProperties": false,
      "required": [
        "recognizer_id",
        "recognizer_version",
        "translator_id",
        "translator_version",
        "vocabulary_version",
        "confidence_kind"
      ],
      "properties": {
        "recognizer_id": {
          "const": "signchat_asl_signs_onnx"
        },
        "recognizer_version": {
          "const": "signchat_asl_signs_onnx"
        },
        "translator_id": {
          "const": "asl_label_to_english"
        },
        "translator_version": {
          "const": "1.0.0"
        },
        "vocabulary_version": {
          "const": "popsign_250_en_v1"
        },
        "confidence_kind": {
          "const": "normalized_model_score"
        }
      }
    },
    "alternative": {
      "type": "object",
      "additionalProperties": false,
      "required": [
        "rank",
        "word",
        "confidence"
      ],
      "properties": {
        "rank": {
          "type": "integer",
          "minimum": 2,
          "maximum": 5
        },
        "word": {
          "$ref": "#/$defs/englishWord"
        },
        "confidence": {
          "$ref": "#/$defs/score"
        }
      }
    },
    "wordToken": {
      "type": "object",
      "additionalProperties": false,
      "required": [
        "index",
        "token_id",
        "word",
        "confidence",
        "alternatives"
      ],
      "properties": {
        "index": {
          "type": "integer",
          "minimum": 0,
          "maximum": 63
        },
        "token_id": {
          "$ref": "#/$defs/identifier"
        },
        "word": {
          "$ref": "#/$defs/englishWord"
        },
        "confidence": {
          "$ref": "#/$defs/score"
        },
        "alternatives": {
          "type": "array",
          "minItems": 0,
          "maxItems": 4,
          "items": {
            "$ref": "#/$defs/alternative"
          }
        }
      }
    }
  }
}
